{
  "$schema": "http://json-schema.org/draft-07/schema#",
  "$id": "https://github.com/Itamartz/HDT/schemas/state.schema.json",
  "title": "HDT run state document (state.json)",
  "description": "DESIGN 4.3's state document: the resolved variables, the step index, the per-step results and the autologon lifecycle of one deployment run. Written to X:\\HDT\\state.json in WinPE, mirrored to the target volume as soon as one is formatted, and read back on every resume. Assert-HDTRunStateDocument is the engine's own validator and must agree with this schema on every document.",
  "type": "object",
  "required": [
    "schemaVersion",
    "runId",
    "sequenceId",
    "status",
    "phase",
    "leg",
    "seq",
    "startedUtc",
    "updatedUtc",
    "stepIndex",
    "pauseOnError",
    "variable",
    "step",
    "autoLogon"
  ],
  "additionalProperties": false,
  "properties": {
    "schemaVersion": {
      "description": "Exactly 1. A newer version means the workspace was written by a newer engine, and the engine is upgraded rather than the document downgraded.",
      "enum": [
        1
      ]
    },
    "runId": {
      "description": "The deployment run id, also _HDTRunId.",
      "type": "string",
      "minLength": 1
    },
    "sequenceId": {
      "description": "The sequence's id from sequence.yaml.",
      "type": "string",
      "minLength": 1
    },
    "status": {
      "description": "Running until the sequence ends. Succeeded or Failed is what makes the run abandoned to the boot reconcile.",
      "enum": [
        "Running",
        "Succeeded",
        "Failed"
      ]
    },
    "phase": {
      "enum": [
        "WinPE",
        "FullOS"
      ]
    },
    "deploymentType": {
      "description": "What the run IS, decided on its first leg and carried from there: NEWCOMPUTER from a WinPE start, REFRESH from a full-OS one. The phase is re-derived every leg; this is not, because a Refresh's second leg runs in WinPE and re-deriving would rename the run mid-flight. Optional, not required, for the reason logLevel is: a document written before this key existed belongs to a run that is still going, and an absent value unlocks nothing.",
      "enum": [
        "NEWCOMPUTER",
        "REFRESH"
      ]
    },
    "leg": {
      "description": "1-based, incremented on every resume.",
      "type": "integer",
      "minimum": 1
    },
    "seq": {
      "description": "The last JSONL seq number written. This is how DESIGN 4.4.2's monotonic seq survives a reboot.",
      "type": "integer",
      "minimum": 0
    },
    "logLevel": {
      "description": "DESIGN 4.4.5's verbosity, as the run started at it. This is how the LEVEL survives a reboot, exactly as seq is how the numbering does: the resumed leg builds its log context before the share is reachable, so the level cannot be re-read from workspace.yaml there. Optional, and absent means Info, because a document written by an engine that predates the key is still a document a resume must be able to read.",
      "enum": [
        "Error",
        "Warning",
        "Info",
        "Debug"
      ]
    },
    "startedUtc": {
      "description": "ISO 8601 round-trip format, as a STRING. A raw datetime serialises as \\/Date(...)\\/ under Windows PowerShell 5.1, which is the engine that writes this file in WinPE.",
      "type": "string",
      "minLength": 1
    },
    "updatedUtc": {
      "description": "Stamped on every save. A Running document whose updatedUtc is older than the age limit is an abandoned deployment.",
      "type": "string",
      "minLength": 1
    },
    "stepIndex": {
      "description": "The 1-based index of the NEXT step to run. It advances past a Completed or Skipped step and stays put for a Failed one, so a failed run resumes at the failure rather than after it.",
      "type": "integer",
      "minimum": 1
    },
    "pauseOnError": {
      "description": "DESIGN 4.3's LTISuspend equivalent: drop to a prompt with the state loaded rather than ending the sequence.",
      "type": "boolean"
    },
    "variable": {
      "description": "The resolved variables, name to value. Values may be scalars or lists.",
      "type": "object",
      "additionalProperties": true
    },
    "step": {
      "description": "One record per flattened step, in index order.",
      "type": "array",
      "items": {
        "$ref": "#/definitions/step"
      }
    },
    "autoLogon": {
      "$ref": "#/definitions/autoLogon"
    }
  },
  "definitions": {
    "step": {
      "type": "object",
      "required": [
        "index",
        "name",
        "type",
        "status",
        "attempt",
        "resumable"
      ],
      "additionalProperties": false,
      "properties": {
        "index": {
          "description": "1-based position in the flattened sequence.",
          "type": "integer",
          "minimum": 1
        },
        "name": {
          "type": "string",
          "minLength": 1
        },
        "type": {
          "type": "string",
          "minLength": 1
        },
        "group": {
          "description": "The group path this step sits under, outermost first.",
          "type": [
            "array",
            "null"
          ],
          "items": {
            "type": "string"
          }
        },
        "status": {
          "enum": [
            "Pending",
            "Running",
            "Completed",
            "Failed",
            "Skipped"
          ]
        },
        "attempt": {
          "description": "How many times this step has been started. 0 until it first runs.",
          "type": "integer",
          "minimum": 0
        },
        "leg": {
          "description": "Which leg last touched this step, so a resume can say 'completed on leg 1' rather than 'on some earlier leg'. Null until it runs.",
          "type": [
            "integer",
            "null"
          ],
          "minimum": 1
        },
        "resumable": {
          "description": "DESIGN 4.3: on resume the engine re-runs an interrupted step only if it declares resumable.",
          "type": "boolean"
        },
        "startedUtc": {
          "type": [
            "string",
            "null"
          ]
        },
        "endedUtc": {
          "type": [
            "string",
            "null"
          ]
        },
        "durationMs": {
          "type": [
            "integer",
            "null"
          ]
        },
        "exitCode": {
          "type": [
            "integer",
            "null"
          ]
        },
        "message": {
          "type": [
            "string",
            "null"
          ]
        }
      }
    },
    "autoLogon": {
      "description": "DESIGN 4.5's autologon lifecycle, so the boot reconcile can tear down exactly what was armed.",
      "type": "object",
      "required": [
        "armed"
      ],
      "additionalProperties": false,
      "properties": {
        "armed": {
          "type": "boolean"
        },
        "userName": {
          "type": [
            "string",
            "null"
          ]
        },
        "domainName": {
          "type": [
            "string",
            "null"
          ]
        },
        "countSet": {
          "description": "The AutoLogonCount the engine wrote: the number of legs remaining.",
          "type": [
            "integer",
            "null"
          ],
          "minimum": 0
        },
        "secretName": {
          "type": [
            "string",
            "null"
          ]
        },
        "runOnceName": {
          "type": [
            "string",
            "null"
          ]
        }
      }
    }
  }
}
